{"schemaVersion": 1, "familyId": "example-family", "familyVersion": 1, "domainOwner": {"rustCrate": "classic-example-core"}, "fixtureRoot": "tests/fixtures/example-family", "fixtures": {"primaryInput": "primary.txt"}, "capabilities": [{"id": "example.execute", "rustSymbols": ["Request", "execute"], "observationFamilies": ["result"]}], "scenarios": [{"id": "base-case", "action": "example.execute", "capabilityIds": ["example.execute"], "fixtureRefs": ["primaryInput"], "input": {"enabled": true}, "expected": {"status": "completed"}, "normalization": {"rootRelativePaths": false, "excludedPaths": [], "unorderedPaths": [], "optionalEmptyFiles": [{"path": "$.tree", "relativePath": "settings.lock", "rationale": " "}]}}], "consumerObligations": [{"id": "example-rendering"}]}